{
  "$schema": "https://json-schema.org/draft-07/schema#",
  "title": "L3 Slice Evidence Manifest",
  "type": "object",
  "additionalProperties": true,
  "required": [
    "schema_version",
    "level",
    "target_id",
    "slice_id",
    "status",
    "source_commit",
    "repo_commit",
    "fixture",
    "evidence",
    "claim_boundary"
  ],
  "properties": {
    "schema_version": {
      "type": "integer",
      "minimum": 1
    },
    "level": {
      "const": "L3"
    },
    "target_id": {
      "type": "string",
      "minLength": 1
    },
    "slice_id": {
      "type": "string",
      "minLength": 1
    },
    "status": {
      "enum": [
        "passed",
        "failed",
        "incomplete"
      ]
    },
    "source_commit": {
      "type": "string",
      "minLength": 7
    },
    "repo_commit": {
      "type": "string",
      "minLength": 7
    },
    "fixture": {
      "type": "object",
      "required": [
        "path",
        "hash"
      ],
      "properties": {
        "path": {
          "type": "string",
          "minLength": 1
        },
        "hash": {
          "type": "string",
          "minLength": 1
        },
        "operation_count": {
          "type": "integer",
          "minimum": 0
        }
      }
    },
    "evidence": {
      "type": "object",
      "required": [
        "slice_contract",
        "context_pack",
        "c2rust_baseline",
        "route_decision",
        "validation_profile",
        "cache_metadata",
        "config_profile",
        "pointer_dependency_graph",
        "test_translation",
        "c_oracle",
        "rust_report",
        "schema_diff",
        "negative_diff",
        "rust_check",
        "unsafe_scan",
        "unsafe_ledger",
        "performance_smoke",
        "final_verification",
        "summary",
        "version_or_config_binding"
      ],
      "additionalProperties": {
        "$ref": "#/definitions/evidenceRef"
      },
      "properties": {
        "negative_diff": {
          "allOf": [
            {
              "$ref": "#/definitions/evidenceRef"
            },
            {
              "type": "object",
              "required": [
                "mutation_detected"
              ],
              "properties": {
                "mutation_detected": {
                  "type": "boolean"
                },
                "expected_failure": {
                  "type": "boolean"
                }
              }
            }
          ]
        },
        "performance_smoke": {
          "allOf": [
            {
              "$ref": "#/definitions/evidenceRef"
            },
            {
              "type": "object",
              "properties": {
                "secondary_only": {
                  "const": true
                }
              }
            }
          ]
        },
        "config_profile": {
          "allOf": [
            {
              "$ref": "#/definitions/evidenceRef"
            },
            {
              "type": "object",
              "required": [
                "profile_id"
              ],
              "properties": {
                "profile_id": {
                  "type": "string",
                  "minLength": 1
                }
              }
            }
          ]
        },
        "c2rust_baseline": {
          "$ref": "#/definitions/evidenceRef"
        },
        "route_decision": {
          "allOf": [
            {
              "$ref": "#/definitions/evidenceRef"
            },
            {
              "type": "object",
              "properties": {
                "level": {
                  "enum": [
                    "L0",
                    "L1",
                    "L2",
                    "L3",
                    "L4"
                  ]
                }
              }
            }
          ]
        },
        "validation_profile": {
          "allOf": [
            {
              "$ref": "#/definitions/evidenceRef"
            },
            {
              "type": "object",
              "properties": {
                "profile": {
                  "type": "string",
                  "minLength": 1
                }
              }
            }
          ]
        },
        "pointer_dependency_graph": {
          "allOf": [
            {
              "$ref": "#/definitions/evidenceRef"
            },
            {
              "type": "object",
              "properties": {
                "not_applicable_reason": {
                  "type": "string"
                }
              }
            }
          ]
        },
        "test_translation": {
          "allOf": [
            {
              "$ref": "#/definitions/evidenceRef"
            },
            {
              "type": "object",
              "properties": {
                "not_applicable_reason": {
                  "type": "string"
                }
              }
            }
          ]
        }
      }
    },
    "claim_boundary": {
      "type": "object",
      "required": [
        "scope",
        "behavior_fields_checked",
        "accepted_metadata_differences",
        "known_gaps",
        "must_not_claim"
      ],
      "properties": {
        "scope": {
          "type": "string",
          "minLength": 1
        },
        "behavior_fields_checked": {
          "type": "array",
          "items": {
            "type": "string"
          }
        },
        "accepted_metadata_differences": {
          "type": "array",
          "items": {
            "type": "string"
          }
        },
        "known_gaps": {
          "type": "array",
          "items": {
            "type": "string"
          }
        },
        "must_not_claim": {
          "type": "array",
          "items": {
            "type": "string"
          }
        }
      }
    }
  },
  "allOf": [
    {
      "if": {
        "properties": {
          "status": {
            "const": "passed"
          }
        }
      },
      "then": {
        "properties": {
          "evidence": {
            "properties": {
              "negative_diff": {
                "properties": {
                  "mutation_detected": {
                    "const": true
                  }
                },
                "required": [
                  "mutation_detected"
                ]
              }
            }
          }
        }
      }
    }
  ],
  "definitions": {
    "evidenceRef": {
      "type": "object",
      "required": [
        "path",
        "status"
      ],
      "properties": {
        "path": {
          "type": "string",
          "minLength": 1
        },
        "sha256": {
          "type": "string"
        },
        "status": {
          "type": "string",
          "minLength": 1
        }
      }
    }
  }
}
