{
  "claim_boundary": {
    "accepted_metadata_differences": [],
    "alias_gate": {
      "complete_alias_safety": false,
      "decision": "not_applicable",
      "preconditions": [],
      "requires_noalias": false,
      "risk_count": 0,
      "risk_level": "none"
    },
    "behavior_fields_checked": [
      "return_code",
      "status",
      "out0"
    ],
    "known_gaps": [
      "No full project migration claim.",
      "No support for NULL out pointers.",
      "No support for INT_MAX because signed C overflow is undefined behavior.",
      "No support for out[i], pointer arithmetic, aliasing, or struct field writes.",
      "Auto-generated Rust draft remains a candidate; accepted semantics are bound to the referenced Rust replay evidence."
    ],
    "must_not_claim": [
      "full automatic C99/C11 translation",
      "whole-program alias safety",
      "NULL pointer equivalence",
      "signed overflow equivalence",
      "semantic equivalence for this auto-generated Rust draft",
      "full C99/C11 automatic translation"
    ],
    "scope": "Automatic translation run completed with accepted evidence binding; the generated Rust draft is provenance evidence and remains a candidate unless a later gate explicitly accepts that exact draft."
  },
  "evidence": {
    "c2rust_baseline": {
      "path": "validation/evidence/demo/auto-translation/store-add-one/l3-store-add-one-c2rust-baseline-manifest.json",
      "sha256": "970f20b959697890f003f4ad3aaf91b76b10de50a9743c30c7b01ff60a232d82",
      "status": "skipped"
    },
    "c_oracle": {
      "path": "validation/evidence/demo/auto-translation/store-add-one/l3-store-add-one-c-oracle-status.json",
      "sha256": "cda30818f1627957dd581bba8c5957e687de286dbddce0956602e74d45bed0ec",
      "status": "C_ORACLE_GENERATED"
    },
    "cache_metadata": {
      "path": "validation/evidence/demo/auto-translation/store-add-one/l3-store-add-one-auto-cache-metadata.json",
      "sha256": "2dd6695f6207bc7b355546a68385f0023ba3fc05db95c4104d0fcd49148fb44e",
      "status": "recorded"
    },
    "config_profile": {
      "path": "validation/evidence/demo/auto-translation/store-add-one/l3-store-add-one-config-profile.json",
      "profile_id": "demo-store-add-one-wsl-gcc",
      "sha256": "bf94e9bb01f3c0e805cfe4f378f6ed07776a4335f633b525c7dc76f7604e053f",
      "status": "recorded"
    },
    "context_pack": {
      "path": "validation/evidence/demo/auto-translation/store-add-one/l3-store-add-one-context-pack.json",
      "sha256": "9312e7a5efea450b86b46dc26e2a14718d2950081e1975b2a20e2a6c6600a5ca",
      "status": "recorded"
    },
    "final_verification": {
      "path": "validation/evidence/demo/auto-translation/store-add-one/l3-store-add-one-final-verification.json",
      "sha256": "dcf1cfe311b07db6f4d9f9f37646f42cd98944c3e67cd435c00531a8a8834945",
      "status": "passed"
    },
    "negative_diff": {
      "expected_failure": true,
      "mutation_detected": true,
      "path": "validation/evidence/demo/auto-translation/store-add-one/l3-store-add-one-negative-diff.json",
      "sha256": "311b9cd997632aa96979d23f397912022b521b9badad2ff32f8cf4e3183b16b9",
      "status": "expected_failed"
    },
    "performance_smoke": {
      "path": "validation/evidence/demo/auto-translation/store-add-one/l3-store-add-one-performance-smoke.json",
      "secondary_only": true,
      "sha256": "278d1e7e2601b2fdf9cce8eb071d71ab2e9a2e215be4eb67197038b1981d10af",
      "status": "recorded"
    },
    "pointer_dependency_graph": {
      "path": "validation/evidence/demo/auto-translation/store-add-one/l3-store-add-one-pointer-graph.json",
      "sha256": "2000233a77aec8dcc1be2f1d6b81b860b226e31aabd46d235819246484026ef1",
      "status": "recorded"
    },
    "route_decision": {
      "level": "L1",
      "path": "validation/evidence/demo/auto-translation/store-add-one/l3-store-add-one-route-decision.json",
      "sha256": "0ce195cc3f8815329a9377bff4510370c5ca4b30a64952b7a0d95d5d8ddc98b5",
      "status": "recorded"
    },
    "rust_check": {
      "path": "validation/evidence/demo/auto-translation/store-add-one/rust-check.json",
      "sha256": "5a45680feb869fe26c71d6899ba1a910182bfa5f5ef9320e83c8fd8d6b2123be",
      "status": "passed"
    },
    "rust_report": {
      "path": "validation/evidence/demo/auto-translation/store-add-one/l3-store-add-one-rust-report.json",
      "sha256": "f3d499bb25286c85d27078dd9ed7c1b17d0f2f98a84ba4b70e3c152af2ae613d",
      "status": "passed"
    },
    "schema_diff": {
      "path": "validation/evidence/demo/auto-translation/store-add-one/l3-store-add-one-diff.json",
      "sha256": "d561c4a99b2361b14d4cd288419c53929a97bd27335c89e43aac10b673303565",
      "status": "passed"
    },
    "slice_contract": {
      "path": "validation/evidence/demo/auto-translation/store-add-one/l3-store-add-one-slice-contract.json",
      "sha256": "e1d4f585963d4bd4883b1c8be8b7a9d37347c94cb36e006a772aaa77eb9096fd",
      "status": "recorded"
    },
    "summary": {
      "path": "validation/evidence/demo/auto-translation/store-add-one/l3-store-add-one-summary.json",
      "sha256": "e2063ecdec61039f00d26b0f06f3bd9c1656531ab54fd4e2c3c77cb246af28f6",
      "status": "passed"
    },
    "test_translation": {
      "path": "validation/evidence/demo/auto-translation/store-add-one/l3-store-add-one-test-translation-generated.json",
      "sha256": "ff72e7ef81f9974cba35242603fe5e8339c84cc0c534119a49d3bdf992ab8878",
      "status": "recorded"
    },
    "unsafe_ledger": {
      "path": "validation/evidence/demo/auto-translation/store-add-one/l3-store-add-one-unsafe-ledger.json",
      "sha256": "86484b4554cb417893b85c5a936df4f7cf9fc102139077b1a37d9c688be0cf06",
      "status": "passed"
    },
    "unsafe_scan": {
      "path": "validation/evidence/demo/auto-translation/store-add-one/l3-store-add-one-unsafe-scan.json",
      "sha256": "c05fa373c61958f78b21c856a89e3585136d7866bc53a220793dfa9e632e76b9",
      "status": "passed"
    },
    "validation_profile": {
      "path": "validation/evidence/demo/auto-translation/store-add-one/l3-store-add-one-validation-profile.json",
      "profile": "L1-dev",
      "sha256": "63034609b56e9fc176aab36b55d9f5a36ca5ae562edefde22b4b70830a0677b9",
      "status": "passed"
    },
    "version_or_config_binding": {
      "path": "validation/evidence/demo/auto-translation/store-add-one/l3-store-add-one-version-manifest.json",
      "sha256": "572e82de04223c3c35300422c2490191b3ad2083b5dbe07cd83a28a652fe449c",
      "status": "recorded"
    }
  },
  "fixture": {
    "hash": "store-add-one-fixture",
    "operation_count": 3,
    "path": "validation/l2_slices/fixtures/store-add-one-c-oracle.json"
  },
  "level": "L3",
  "repo_commit": "ad29b3ff86fa0dd2e80da364f78d88a70d5df526",
  "schema_version": 1,
  "slice_id": "store-add-one",
  "source_commit": "demo-store-add-one-20260625",
  "status": "passed",
  "target_id": "demo"
}
